{"active_block_id":"lab-c-batch-urgent","canonicalization":"RFC8785","frozen_case_id":"revision","lab_id":"C","lock_sha256":"sha256:f1d1fe3339137d56e4e9ea9d141b764eaa183a8f40933bad597d734bbf310197","policy_api_version":"lora-energy-policy-v1","policy_sha256":"sha256:05d5803368b538dcc31275547725a82e5e9f0c87cec3cc21c04d9bc0643182dd","predecessor_policy_sha256":"sha256:64bd4b29b23005aaddd3597b5c693766e59d1bf38be743f6eab98907164c9bda","receipt_sha256":"sha256:148f5e01aabda47baacde859d7f6742081b90942a637034c0fccd81ecd1a0a2c","scenario_anchor_sha256":"sha256:cfe84682a71c0c0ea09c273d4cd033c32818da63cf1695ace4363b9d789c50f9","scenario_id":"ntpu-energy-decision-01","scenario_sha256":"sha256:c157c76ed283074cdd17c1b689b83e168022abd2ca6ef8d9c337e69ab31a6593","schema_version":"lora-energy-freeze-receipt-v1","seed":12003,"seed_role":"lab-c-primary","upstream_commit":"f854462cda0cd30cb56e3f0c576cb004711842f6","wrapper_version":"lora-energy-runner-v1"}
