{"active_block_id":"lab-a-pace-rest","canonicalization":"RFC8785","frozen_case_id":"candidate","lab_id":"A","lock_sha256":"sha256:f1d1fe3339137d56e4e9ea9d141b764eaa183a8f40933bad597d734bbf310197","policy_api_version":"lora-energy-policy-v1","policy_sha256":"sha256:325cca4a4be339a9d69e2911123714556135859dc6089cac271c6e6d0d73cf2f","predecessor_policy_sha256":"sha256:9917d2cde2e8c0eae8339b7eea2e358bf8577b4eb6aaf1e928674f6b8964ef68","receipt_sha256":"sha256:6cbaf9dccc812994bec08c0f898b8d21d68a3d84412137a9966de71667e11626","scenario_anchor_sha256":"sha256:cfe84682a71c0c0ea09c273d4cd033c32818da63cf1695ace4363b9d789c50f9","scenario_id":"ntpu-energy-decision-01","scenario_sha256":"sha256:c157c76ed283074cdd17c1b689b83e168022abd2ca6ef8d9c337e69ab31a6593","schema_version":"lora-energy-freeze-receipt-v1","seed":12001,"seed_role":"lab-a-primary","upstream_commit":"f854462cda0cd30cb56e3f0c576cb004711842f6","wrapper_version":"lora-energy-runner-v1"}
