{"active_block_id":"lab-b-enter-exit-hold","canonicalization":"RFC8785","frozen_case_id":"trace-a-candidate","lab_id":"B","lock_sha256":"sha256:f1d1fe3339137d56e4e9ea9d141b764eaa183a8f40933bad597d734bbf310197","policy_api_version":"lora-energy-policy-v1","policy_sha256":"sha256:c00ed808d3a225abff99a19aee7426570c274b60b46231382be4407c78293718","predecessor_policy_sha256":"sha256:325cca4a4be339a9d69e2911123714556135859dc6089cac271c6e6d0d73cf2f","receipt_sha256":"sha256:2a4167e25699ec366687559d1ec7259d8b874f990b81653a5fbb45b171349e0e","scenario_anchor_sha256":"sha256:cfe84682a71c0c0ea09c273d4cd033c32818da63cf1695ace4363b9d789c50f9","scenario_id":"ntpu-energy-decision-01","scenario_sha256":"sha256:c157c76ed283074cdd17c1b689b83e168022abd2ca6ef8d9c337e69ab31a6593","schema_version":"lora-energy-freeze-receipt-v1","seed":12002,"seed_role":"lab-b-trace-a","upstream_commit":"f854462cda0cd30cb56e3f0c576cb004711842f6","wrapper_version":"lora-energy-runner-v1"}
